{
  "schema_version": "1.0",
  "work_id": "<work_id>",
  "character_id": "Character A",
  "baseline_tone": "冷淡疏离、言简意赅。公开场合冰冷威严，私下面对Character B时偶有柔软但仍以克制为主。语气中自带上位者的矜持和压迫感。",
  "speech_patterns": [
    "极少主动开口，多以行动代替语言（拔剑、冰封、转身离去）",
    "愤怒或拒绝时用极短的单字或双字回应（'滚'、'闭嘴'、'不许'）",
    "情绪松动时语句会变长但仍克制，不会直接表达感情",
    "被Character B撩到时会以命令式语句掩饰慌乱（'你再说一遍试试'）",
    "正式场合使用'本座'自称",
    "对Character B的称呼随关系演变：'你'→名字→'夫君'（后期）"
  ],
  "vocabulary_preferences": [
    "偏好古风正式用语",
    "避免口语化和轻浮表达",
    "极少使用语气词",
    "在私密场合偶尔会用低声细语"
  ],
  "signature_phrases": [
    "滚",
    "闭嘴",
    "本座",
    "嗯",
    "何事",
    "无碍"
  ],
  "emotional_voice_map": [
    {
      "emotion": "愤怒",
      "voice_shift": "语气变得极度冰冷，用词尖锐简短，自带寒气压迫感",
      "typical_expressions": ["滚", "你找死"]
    },
    {
      "emotion": "害羞",
      "voice_shift": "声音不自觉放轻，语速加快试图掩饰，耳尖泛红",
      "typical_expressions": ["谁……谁要你管", "不许再说了"]
    },
    {
      "emotion": "嘴硬",
      "voice_shift": "语气强硬但逻辑明显自相矛盾，越描越黑",
      "typical_expressions": ["本座只是顺路", "跟你没关系"]
    },
    {
      "emotion": "关心",
      "voice_shift": "语气仍冷但行动矛盾——嘴上说不在意，手已经在疗伤",
      "typical_expressions": ["你的伤……自己处理不好吗"]
    },
    {
      "emotion": "悲伤",
      "voice_shift": "沉默取代语言，极少哭泣，若哭则是彻底崩溃的无声落泪",
      "typical_expressions": []
    },
    {
      "emotion": "吃醋",
      "voice_shift": "语气变得更冷更硬，会找借口离开或施加冰霜压迫",
      "typical_expressions": ["你去找她好了"]
    }
  ],
  "target_voice_map": [
    {
      "target_type": "Character B（私下）",
      "voice_shift": "冰冷外壳偶有裂缝，语气不自觉变柔。越亲密越容易出现口是心非的矛盾表达。",
      "typical_expressions": ["不许走", "再……再抱一会"]
    },
    {
      "target_type": "陌生人/外人",
      "voice_shift": "全程冰冷威严，极少开口，以气场压制代替言语",
      "typical_expressions": []
    },
    {
      "target_type": "敌对者",
      "voice_shift": "杀意凛然，语句如宣判，不带多余情绪",
      "typical_expressions": ["该死"]
    },
    {
      "target_type": "亲近者（小龙、Character F等）",
      "voice_shift": "保持矜持但语气中有温度，偶尔流露柔软",
      "typical_expressions": []
    }
  ],
  "taboo_patterns": [
    "不会主动撒娇或使用甜言蜜语",
    "不会在公开场合示弱或求助",
    "不会用轻浮的语气说话",
    "不会主动表白（只会用行动暗示）",
    "不会使用现代网络用语或流行梗"
  ],
  "evidence_refs": [
    "0004（'该死！'——愤怒时的简短咒骂）",
    "0005（'你敢！'——帝王式的威胁警告）",
    "0006（'是吗？'——审视性的简短回应）",
    "0007（'谢，谢。'——不熟练的道谢，确认极少使用语气词）",
    "0008（'你好像哭过？'——直截了当的观察式提问）",
    "0009（'放屁！你这是在单相思！'——极度恼怒时罕见的粗鄙用语）",
    "0010（'为什么？'——好奇时的极简提问）",
    "0011（'张嘴。'——命令式的照顾语气confirmed；'何事？'——古风正式回应confirmed）",
    "0013（'跟紧我。'——帝王式指令confirmed；'嗯，我知道你这不是拿来吃的'——冷静打断他人解释）",
    "0016（'别动！'——疗伤时命令式语气confirmed；'无碍。'——极简回应confirmed）",
    "0017（'抗着。'——单字拒绝confirmed）",
    "0023（'带我走……'——几万年来唯一的柔和请求式语气confirmed；'想死我就成全你！'——帝王式冷声宣判confirmed）",
    "0024（'对不起……我打扰到你的行程了。'——几万年来首次主动道歉confirmed；'不吃''真的不吃''我真不想吃'三连拒绝confirmed；'没有。'——被指出耳根红后瞬间否认confirmed）",
    "0025（'你速速穿上全身的衣裳。'——古风命令式语气confirmed即使虚弱时也自然流露）",
    "0026（'别靠近我！'——恐惧时的命令式自保confirmed；'我吃……'——极罕见的柔弱妥协声线confirmed；'嗯……'——带无奈柔软的回应区别于以往冷淡的'嗯'）",
    "0027（'我说了，我不需要。'——恢复后立即回归冷厉confirmed；'王~枫~！！'——首次直呼全名以咬牙切齿方式confirmed）",
    "0032（'小孩子玩的小玩意？'——冷淡评价confirmed极简表达。独处时嘴角微起但对外不说一个字——沉默型情绪表达confirmed）",
    "0037（'心乱了'自我戒令——内心独白简短有力confirmed）",
    "0039（'再叫师娘我便废了你！'——愤怒时短句威胁confirmed。'三！二！一！'——新增倒数施压手段confirmed。'莫不是……你有什么龌龊的想法？'——少见的玩味追问语气）",
    "0040（'噗...'——几万年来首次笑出声confirmed。'傻子！'——以愤骂掩饰心软confirmed。'你为何不躲？'——困惑式极简追问）",
    "0042（'不行！'——脱口而出的短促拒绝confirmed。'想叫便叫，为何叫一半又止住了？'——口是心非到极致：刚说不许叫又催他叫完整）",
    "0043（'对...对不起'——几万年来第二次道歉且结巴confirmed。'笑过了。'——用技术真实掩饰情感逃避confirmed）",
    "0045（'难不成要我以身相许吗？'——以夸张反问化解尴尬confirmed。'别动！''起来！'——命令式掩饰慌乱confirmed）"
  ]
}
